{
  "packet_type": "result",
  "mission_id": "ANTON-ORI052-01",
  "agent": "Anton",
  "submitted_at": "2026-09-26T01:45:00-04:00",
  "start_sha": "444d222405e1eb11fb98bfead96acbd9b1b5cf4e",
  "final_sha": "969eb83a9fe124e0e07614b40c1bd083d3bb1f5d",
  "branch": "feature/plc2-transport-fidelity",
  "pushed": true,
  "working_tree_clean": true,
  "files_changed": [
    "tools/scripts/fortna_safety_model.py",
    "tests/safety/test_safety_d42c_closure.py"
  ],
  "tests_run": [
    "python -m unittest tests.safety.test_safety_d42c_closure",
    "python -m unittest tests.safety.test_safety_area_delete_persistence"
  ],
  "test_results": {
    "passed": 38,
    "failed": 0,
    "errors": 0,
    "skipped": 0,
    "summary": "Ran 38 tests OK"
  },
  "artifacts": [
    "exports/diagnostics/safety_inventory_plc3_evidence.json"
  ],
  "ori_dispositions": [
    {
      "ori_id": "ORI-052",
      "disposition": "FIXED",
      "sha": "969eb83a9fe124e0e07614b40c1bd083d3bb1f5d",
      "notes": "zone persist + canonical writers"
    }
  ],
  "claimed_fixes": [
    "ORI-052"
  ],
  "unresolved_items": [],
  "deviations": [],
  "stop_reason": "COMPLETE",
  "recommended_next_owner": "Warden"
}
