{
  "packet_type": "result",
  "mission_id": "WARDEN-ORI052-01",
  "agent": "Warden",
  "submitted_at": "2026-09-26T02:30:00-04:00",
  "start_sha": "969eb83a9fe124e0e07614b40c1bd083d3bb1f5d",
  "final_sha": "969eb83a9fe124e0e07614b40c1bd083d3bb1f5d",
  "branch": "feature/plc2-transport-fidelity",
  "pushed": false,
  "working_tree_clean": true,
  "files_changed": [],
  "tests_run": [
    "python -m unittest tests.safety.test_safety_d42c_closure",
    "python -m unittest tests.safety.test_safety_area_delete_persistence",
    "TPNA1 reproducer (manual)"
  ],
  "test_results": {
    "passed": 38,
    "failed": 1,
    "errors": 0,
    "skipped": 0,
    "summary": "unit suite OK; TPNA1 reproducer FAIL"
  },
  "artifacts": [
    "artifacts/warden/ORI-052_audit_969eb83.md"
  ],
  "ori_dispositions": [
    {
      "ori_id": "ORI-052",
      "disposition": "FAIL",
      "verified_sha": "969eb83a9fe124e0e07614b40c1bd083d3bb1f5d",
      "reproducer": "TPNA1: import RUN, assign safety zone device on active machine TPNA1, delete/recreate Area, reload workspace -> canonical zone device missing from Safety inventory",
      "evidence": [
        "artifacts/warden/ORI-052_audit_969eb83.md"
      ],
      "notes": "unit tests pass but TPNA1 still loses the device"
    }
  ],
  "claimed_fixes": [],
  "unresolved_items": [
    "ORI-052 still reproduces on TPNA1"
  ],
  "deviations": [],
  "stop_reason": "COMPLETE",
  "recommended_next_owner": "Anton",
  "verified_sha": "969eb83a9fe124e0e07614b40c1bd083d3bb1f5d",
  "new_oris": []
}
