{
  "packet_type": "result",
  "mission_id": "WARDEN-ORI052-02",
  "agent": "Warden",
  "submitted_at": "2026-09-26T10:00:00-04:00",
  "start_sha": "c0de052000000000000000000000000000000052",
  "final_sha": "c0de052000000000000000000000000000000052",
  "branch": "feature/plc2-transport-fidelity",
  "pushed": false,
  "working_tree_clean": true,
  "files_changed": [],
  "tests_run": [
    "python -m unittest tests.safety.test_safety_d42c_closure",
    "python -m unittest tests.safety.test_safety_area_delete_persistence",
    "TPNA1 reproducer (manual)"
  ],
  "test_results": {
    "passed": 42,
    "failed": 0,
    "errors": 0,
    "skipped": 0,
    "summary": "unit suite OK; TPNA1 reproducer PASS"
  },
  "artifacts": [
    "artifacts/warden/ORI-052_audit_c0de052.md"
  ],
  "ori_dispositions": [
    {
      "ori_id": "ORI-052",
      "disposition": "PASS",
      "verified_sha": "c0de052000000000000000000000000000000052",
      "reproducer": "TPNA1: import RUN, assign safety zone device on active machine TPNA1, delete/recreate Area, reload workspace -> canonical zone device missing from Safety inventory",
      "evidence": [
        "artifacts/warden/ORI-052_audit_c0de052.md"
      ]
    }
  ],
  "claimed_fixes": [],
  "unresolved_items": [],
  "deviations": [],
  "stop_reason": "COMPLETE",
  "recommended_next_owner": "Curtis",
  "verified_sha": "c0de052000000000000000000000000000000052",
  "new_oris": []
}
